Nome da Música,link,album,letra,artista
Música Secreta,/manu-gavassi/musica-secreta.html,CUTE BUT (still) PSYCHO,"Acordo um pouco tonta Sentindo a liberdade Faz tempo que eu decidi viver a minha idade Saio atrasada sentindo um vazio E a sensação é que eu nem moro mais aqui Falta de casa mas medo de ficar E perder o mundo acontecendo sem parar Mente cheia de sonhos e o meu corpo a mil Coração fechado, quem se aproximou sentiu  E faz tempo que eu quero te falar Que aquela noite eu chorei Mas não foi nada com você Na verdade eu chorei porque eu falei que ia embora E você nem teve medo de perder  E faz tempo que eu percebo que o que o universo manda Só pra rir e te fazer crescer E que piada engraçada do universo Me mostrar que dentre tantos, aprendi com você  Se a minha intensidade ainda for me matar Se a minha intensidade ainda for me matar Eu prefiro ser poesia e ter historias pra contar  Estou nos meus princípios, minhas convicções Prometo me abrir só pra quem merecer canções Mas aqui estou me traindo com você Amanhã faço de novo prometendo não fazer  Então só por essa noite a minha pele é sua E o conflito de certo e errado continua Talvez eu pense muito Talvez seja você Com o medo que a nossa geração tem de crescer  Se a minha intensidade ainda for me matar Se a minha intensidade ainda for me matar Eu prefiro ser poesia e ter historias pra contar  (Se a minha intensidade ainda for me matar) (Se a minha intensidade ainda for me matar) Eu prefiro ser poesia e ter historias pra contar  Se a minha intensidade ainda for me matar Se a minha intensidade ainda for me matar Eu prefiro ser poesia e ter historias pra contar  Se a minha intensidade ainda for me matar Se a minha intensidade ainda for me matar Eu prefiro ser poesia e ter historias pra contar",Manu Gavassi
Ninguém Vai Saber,/manu-gavassi/ninguem-vai-saber.html,MANU,"Pensando bem Eu não confio em ninguém Mas você me deu vontade de tentar Você me deu vontade de tentar Se eu te chamo, diz que vem Não sei o que você tem Mas só sei que dá vontade de tocar Só sei que dá vontade de tocar  Se eu quero e você quer Então tá tudo bem O seu corpo no meu Não conta pra ninguém Eu não vou contar, não vou contar Se eu quero e você quer Então tá tudo bem O seu corpo no meu Não fala pra ninguém Eu não vou falar, não vou falar  Ninguém vai saber, só eu e você Ninguém vai saber, só eu e você Ninguém vai saber, só eu e você Ninguém vai saber Ninguém vai saber  Pensando bem Eu não confio em ninguém Mas você me deu vontade de tentar Você me deu vontade de tentar Se eu te chamo, diz que vem Não sei o que você tem Mas só sei que dá vontade de tocar Só sei que dá vontade de tocar  Se eu quero e você quer Então tá tudo bem O seu corpo no meu Não conta pra ninguém Eu não vou contar, não vou contar Se eu quero e você quer Então tá tudo bem O seu corpo no meu Não fala pra ninguém Eu não vou falar, não vou falar  Ninguém vai saber, só eu e você Ninguém vai saber, só eu e você Ninguém vai saber, só eu e você Ninguém vai saber Ninguém vai saber",Manu Gavassi
Ninguém Vai Saber (Part. Agir),/manu-gavassi/ninguem-vai-saber-part-agir.html,,"Pensando bem, eu não confio em ninguém Mas você me deu vontade de tentar Você me deu vontade de tentar Se eu te chamo, diz que vem Não sei o que você tem Mas só sei que dá vontade de tocar Só sei que dá vontade de tocar  Se eu quero e você quer, então tá tudo bem O seu corpo no meu, não conta pra ninguém Eu não vou contar, não vou contar Se eu quero e você quer, então tá tudo bem O seu corpo no meu, não conta pra ninguém Eu não vou falar, não vou falar  Ninguém vai saber, só eu e você Ninguém vai saber, só eu e você Ninguém vai saber, só eu e você Ninguém vai saber, ninguém vai saber Ninguém vai saber, só eu e você Ninguém vai saber, só eu e você Ninguém vai saber, só eu e você Ninguém vai saber, ninguém vai saber  Ninguém vai saber Se tu não disseres, eu não vou dizer Não, perder tempo pra quê? Quando tudo que eu quero é poder fazer Coisas que eu nunca vá esquecer Dentre quatro paredes fazer acontecer Que eu faço valer a pena, baby, podes crer E amanhã? Amanhã logo se vê Eu já te dei o ok, hey Não vou deixar nada mei, hey Esquece o teu homem Porque o teu homem não sabe as coisas que eu sei, hey Fica entre nós, baby, [?] bem O que quiseres que eu faço, eu faço sem problema Tu queres com o gajo, taí Então descansa que ninguém, ninguém  Ninguém vai saber, só eu e você Ninguém vai saber, só eu e você Ninguém vai saber, só eu e você Ninguém vai saber, ninguém vai saber  Pensando bem Não deixes para amanhã o que podia ser agora Pensando bem É só deixastes levar assim pela noite afora Pensando bem Por mais que eu tente negar, não quero que te vás embora Só sei que dá vontade de tocar (dá) Só sei que dá vontade de tocar Pensando bem Não deixa para amanhã o que podia ser agora Pensando bem É só se deixar levar, quando é assim não controla Pensando bem Por mais que eu tente negar, eu quero você, não demora Só sei que dá vontade de tocar Só sei que dá vontade de  Ninguém vai saber, só eu e você Ninguém vai saber, só eu e você Ninguém vai saber, só eu e você Ninguém vai saber, ninguém vai saber  Ninguém vai saber, não Vai, vai Ninguém vai saber Agir! Manu!",Manu Gavassi
O Céu Eu Vou Tocar,/manu-gavassi/o-ceu-eu-vou-tocar.html,,Ventos frios me chamando Vejo o céu azul brilhar As montanhas sussurrando Que pra luz vão me levar Vou correr Vou voar E o céu eu vou tocar Vou voar E o céu eu vou tocar  Onde os bosques tem segredos E as montanhas imensidão Águas guardam os reflexos Dos tempos que se vão Vou gostar de cada história Meu sonho guardarei Como o mar e a tempestade Valente sempre serei  Vou correr Vou voar E o céu eu vou tocar Vou voar E o céu eu vou tocar  Eu vou tocar Como o vento voar Céu tocar,Manu Gavassi
O Fim,/manu-gavassi/o-fim.html,Clichê Adolescente,"Assoviando uma canção Sentindo nossos corações mais distantes Do que realmente estão As luzes lá fora chamam pra sair A noite sempre me encantou Mais agora você não está aqui  E, é engraçado como tudo aconteceu Do seu lado eu te olhei você percebeu Como agora tudo está perfeito assim Como a vida tinha um plano depois do fim O fim, foi só pra sentir saudade Então volta pra mim Não quero sentir sua falta Me leva com você E canta aquele refrão que me faz perceber Talvez não possa ficar um dia sem você  Os minutos passam devagar Ouvi dizer que com o tempo a gente aprende A suportar A cidade escura tenta me entreter Enquanto você olha o mar, me afogo em pranto Na vontade de você E, sinto que é errado precisar tanto assim De nós Do seu lado eu sou inteira, eu sou bem melhor Você diz que tudo está perfeito assim Que a vida tinha um plano depois do fim O fim, foi só pra sentir saudade Então volta pra mim Não quero sentir sua falta Me leva com você E canta aquele refrão que me faz perceber Talvez não possa ficar um dia sem você  O fim, foi só pra sentir saudade Então volta pra mim Não quero sentir sua falta Me leva com você E canta aquele refrão que me faz perceber Talvez não possa ficar um dia sem você",Manu Gavassi
Odeio,/manu-gavassi/odeio.html,,"Eu odeio o seu sorriso, e seu jeito de falar Eu odeio quando você me olha, e eu dou risada sem pensar Eu odeio quando você me chama para conversar Eu odeio quando você vem, e odeio mais ainda te esperar  Eu não sei o que fazer Não tem ninguém aqui pra me impedir de te escrever Outra canção pra me fazer entender Que eu te odeio tanto porque gosto de você  Eu nunca acreditei que era mesmo pra valer Eu nunca admiti que me importava com você Agora tanto faz não quero mais me esconder Estou falando na sua frente que eu te odeio Por gostar tanto assim de você  Eu odeio dar conselhos que você nem vai usar Eu odeio quando você fala dela e eu finjo não ligar Eu odeio ver você com alguém que não tem nada a ver Eu odeio ela ser tão sem graça E você nem perceber  Eu não sei o que fazer Não tem ninguém aqui pra me impedir de te escrever Outra canção pra me fazer entender Que eu te odeio tanto por que gosto de você  Eu nunca acreditei que era mesmo pra valer Eu nunca admiti que me importava com você Agora tanto faz não quero mais me esconder Estou falando na sua frente que eu te odeio Por gostar tanto assim de você  Você vai acordar um dia e perceber Que mesmo eu sendo, um pouco estranha do meu jeito Eu tentei te convencer  Que hoje eu acredito que é mesmo pra valer Confesso, eu admito que me importo com você Agora tanto faz não quero mais me esconder Estou falando na sua frente que eu te odeio Por gostar tanto assim de você.",Manu Gavassi
Perigo,/manu-gavassi/perigo.html,MANU,"Não chega assim tão perto, bagunça a minha cabeça Eu lembro juízo e você quer que eu esqueça Decifro a tua vontade lendo a tua boca colada na minha Envolve a minha cintura, cê sabe, é ponto fraco O jeito que segura, eu já nem sei mais o que eu faço Eu já nem sei mais o que eu faço não Já não sei não  [Pré-refrão] Se me pega com vontade, eu peço mais Sem controle, qualquer coisa a gente faz Eu peço mais, eu quero mais, eu quero mais  [Refrão] Eu sei que você é perigo Por isso é tão bom, tão bom Amor, eu nasci pro perigo Por isso eu vou, eu vou  Se eu jogo meu cabelo, bagunço sua cabeça Ainda tenho juízo e antes que desapareça Prometo que te enlouqueço com sua pele colada na minha  [Pré-refrão] Se me pega com vontade, eu peço mais Sem controle, qualquer coisa a gente faz Eu peço mais, eu quero mais, eu quero mais  [Refrão] Eu sei que você é perigo Por isso é tão bom, tão bom Amor, eu nasci pro perigo Por isso eu vou, eu vou  [Pré-refrão] Se me pega com vontade, eu peço mais Sem controle, qualquer coisa a gente faz Eu peço mais, eu quero mais, eu quero mais  [Refrão] Eu sei que você é perigo Por isso é tão bom, tão bom Amor, eu nasci pro perigo Por isso eu vou, eu vou  [Outro] Nananana, nananana",Manu Gavassi
Planos Impossíveis,/manu-gavassi/planos-impossiveis.html,Manu Gavassi,"Uma semana sem te ver, Eu já sabia que isso ia acontecer, O tempo passa eu fico mal, é ilusão achar que tudo está igual, Você, apareceu pra mim, Não posso evitar, me sentir assim.  O que eu faço pra escapar, Dessa vontade que eu tenho de falar, Toda hora com você, Faço planos impossíveis pra te ver, Mas pra mim, são tão reais, O que aconteceu, eu não me lembro mais.  Eu poderia escrever, mil canções só pra você, Poderia te falar, meus motivos pra gostar, tanto de você, me diz quando a gente vai se ver.  Pra eu poder te abraçar, e tentar te explicar, a falta que você me faz, eu não aguento mais, Ficar tão longe, de você.  Você me diz que não tá bem, que não para de pensar em mim também. Agora antes de dormir, por dois segundos eu consigo até sorrir, Porque, essa complicação, distância é o fim, pra quem tem coração.  Será que eu devo te dizer, que eu quase choro quando falam de você. Mas eu consigo segurar, Pra ter certeza que ninguém vai reparar, que eu, to cada vez pior, e a saudade em mim, é cada vez maior.  Eu poderia escrever, mil canções só pra você, Poderia te falar, meus motivos pra gostar, tanto de você, me diz quando a gente vai se ver.  Pra eu poder te abraçar, e tentar te explicar, a falta que você me faz, eu não aguento mais, Ficar tão longe, de você.  E eu não sei se algum dia, eu já me senti assim. Eu nem me lembro de querer alguém, como eu quero você, pra mim. E é por isso, que eu vou te dizer,  Que eu poderia escrever, mil canções só pra você, Poderia te falar, meus motivos pra gostar, tanto de você, me diz quando a gente vai se ver.  Pra eu poder te abraçar, e tentar te explicar, a falta que você me faz, eu não aguento mais, ficar tão longe, de você.  Tão longe de você, tão longe de você.",Manu Gavassi
Pode Falar,/manu-gavassi/pode-falar.html,Manu Gavassi,"Uma música tocando no meu rádio Eu começo a pensar, onde você está Que eu quero te ligar, mesmo sem nada novo pra falar Um filme fofo tá passando na tv, e eu me lembro de você Começo a imaginar, se a gente se casar Eu juro, eu nunca mais vou reclamar  Será que você pensa em mim como eu penso em você? Será que algum dia eu vou saber?  Eu não me importo se você quiser sorrir E me falar que eu sou tudo pra você Me diz, o que eu sempre quis ouvir, vem dizer Eu não vou enjoar, então pode falar Todas as vezes que você pensar em mim Assim, eu fico mais feliz, então pode falar  na na na na...  Uma foto que me faz voltar no tempo quando eu te conheci A gente se falou, e algo começou Você não sabe a marca que deixou E se algum dia a saudade apertar Não espere pra ligar Quero você aqui, isso eu já decidi Se alguém perguntar não vou mentir  Será que você pensa em mim como eu penso em você? Será que algum dia eu vou saber?  Eu não me importo se você quiser sorrir E me falar que eu sou tudo pra você Me diz, o que eu sempre quis ouvir, vem dizer Eu não vou enjoar, então pode falar Todas as vezes que você pensar em mim Assim, eu fico mais feliz, então pode falar  Eu não me importo se você quiser sorrir E me falar que eu sou tudo pra você Me diz, o que eu sempre quis ouvir, vem dizer Eu não vou enjoar, então pode falar Todas as vezes que você pensar em mim Assim, eu fico mais feliz, então pode falar  Na na na na, então pode falar, na na na na, então pode falar.",Manu Gavassi
Pode Até Rolar,/manu-gavassi/pode-ate-rolar.html,Manu Gavassi,"Te olhei de longe, sem querer você estava lá Tentando impressionar Eu logo vi que era tudo que eu sempre pedi É melhor se preparar  Você faz o meu estilo, e eu não vou me arrepender Eu não sei o que aconteceu comigo Não paro de pensar, eu e você pode até rolar Talvez essa batida tenha algo a ver Não vou parar de dançar, quiser você pode vir me acompanhar  Todas elas estão loucas pra saber Quem será que você vai escolher O seu nome eu não consigo adivinhar Porque você não vem me falar  Você faz o meu estilo, e eu não vou me arrepender Eu não sei o que aconteceu comigo Não paro de pensar, eu e você pode até rolar Talvez a batida tenha algo a ver Não vou parar de dançar, se você quiser pode me acompanhar  Chega de ficar parado, venha aqui do meu lado se quiser me conhecer Eu não sei o que aconteceu comigo Não paro de pensar, eu e você pode até rolar Talvez essa batida tenha algo a ver Não vou parar de dançar não na na na  Eu não sei o que aconteceu comigo Não paro de pensa, eu e você pode até rolar Talvez essa batida tenha algo a ver Não vou parar de dançar, se você quiser pode vim me acompanhar",Manu Gavassi
Primeiro Dia,/manu-gavassi/primeiro-dia.html,,Eu te olho com os mesmos olhos De quando eu te conheci Quando eu te tratava meio mal E agora você sabe que eu fingi  Eu te amo muito mais que ontem Quando não havia nada pra se preocupar Quando jurei que você ia embora Mas você decidiu ficar  E quanto tempo faz? Parece que foi ontem Mas eu nem me lembro mais De não te conhecer  E eu sei que vai ser você Quando tudo lá fora mudar Quando o tempo passar E eu sei que sempre foi você Desde o primeiro dia eu vi E agora entendi porque  Você me olha com os mesmos olhos Daquela noite de verão Quando te contei os meus segredos E você fez uma canção  E olhando para trás agora eu sei Que muita coisa já mudou Mas ainda guardo aquele beijo Que um dia você roubou  E quanto tempo faz? Parece que foi ontem Mas eu nem me lembro mais De não te conhecer  E eu sei que vai ser você Quando tudo lá fora mudar Quando o tempo passar E eu sei que sempre foi você Desde o primeiro dia eu vi E agora entendi porque  E eu sei que vai ser você Quando tudo lá fora mudar Quando o tempo passar E eu sei que sempre foi você Desde o primeiro dia eu vi E agora entendi porque  Que vai ser você Quando tudo lá fora mudar Quando o tempo passar E eu sei que sempre foi você Desde o primeiro dia eu vi E agora entendi  Eu te olho com os mesmos olhos De quando eu te conheci,Manu Gavassi
Promete Pra Mim,/manu-gavassi/promete-pra-mim.html,Manu Gavassi,"Promete pra mim Promete pra mim Que vai chegar mensagem no meu celular Dizendo assim: você é tudo pra mim Acho que eu tô começando a exagerar Não preciso de declaração Ainda não Qualquer coisinha que você me diz  Já consegue me tirar a respiração Quando eu falo com você eu fico mais feliz  ""Eu queria você aqui comigo"" Você falou E eu li de novo porque uma parte de mim ainda não acreditou Como eu queria te ligar So pra ouvir sua voz Quem sabe assim descobriria O que existe entre nós  Promete pra mim Promete pra mim Que a distancia entre nós não vai atrapalhar Eu penso assim Se você gosta de mim Será que alguns quilometros vão importar?  Não preciso de declaração Ainda não Qualquer coisinha que você me diz Já consegue me tirar a respiração Quando eu falo com você eu fico mais feliz  ""Eu queria você aqui comigo"" Você falou E eu li de novo Porque uma parte de mim ainda não acreditou Como eu queria te ligar só pra ouvir sua voz Quem sabe assim descobriria o que existe entre nós  Você chegou Eu não acreditei Te juro que agora o que eu quero é uma chance pra te mostrar Sua carta eu guardei junto com tudo o que eu sonhei um dia Te falar Eu sei Me apaixonei por você  ""Eu queria você aqui comigo"" Você falou Eu li de novo porque uma parte de mim ainda não acreditou Como eu queria te ligar só pra ouvir sua voz Quem sabe assim descobriria o que existe entre nós O que existe entre nós O que existe entre nós O que existe entre nós O que existe entre nós",Manu Gavassi
Quatro Notas,/manu-gavassi/quatro-notas.html,Manu Gavassi,"Cinco horas, e eu com o coração na mão; Já são sete não larguei o violão; Quatro notas e eu fiz essa canção;  Como eu queria te falar tudo que eu penso; Você pode me assistir enquanto eu tento; E me perco no meio dessa confusão;  Uma chance pra te ter aqui comigo; Dois minutos são tudo o que preciso; Quatro notas pra fazer você entender;  Estou procurando e não consigo encontrar; Os motivos pra essa história acabar; Só me resta esperar que isso não seja o fim;  Eu já tentei dizer, eu quis te convencer; Que ao seu lado é onde eu devo ficar; É só você deixar...  Uma hora com você no telefone; Sete dias e agora você some; Quatro notas só pra eu me distrair;  Você me enche, mas eu nunca falo nada; Como eu queria ser a sua namorada; Mas pensando bem é melhor deixar assim...  Porque que eu tentei dizer, eu quis te convencer; Que ao seu lado é onde eu devo ficar; É só você deixar...  E se você chegar pedindo pra voltar; Já vai ser tarde demais... Quando você chegar; E pedir pra voltar eu não volto atrás;  Porque eu tentei dizer; eu quis te convencer; Que ao seu lado é onde eu devo ficar; É só você deixar...  Que ao seu lado é onde eu quero ficar; É só você deixar...",Manu Gavassi
Se Eu Te Abraço,/manu-gavassi/se-eu-te-abraco.html,Clichê Adolescente,Acordava sorrindo do seu lado Você me olhava e dizia eu adoro seu cabelo enrolado  Eu nunca vou admitir Mas eu penso nisso toda vez que eu me arrumo pra sair E você não esta aqui  Te ligava a tarde pra conversar Você me contava do seus medos E eu sabia que não tinha nada pra se preocupar  Posso não estar mais com você Mas não tem um dia que não penso em ligar Só pra não esquecer Eu não posso esquecer  Quero ouvir que nada vai mudar Que esse meses frios e o silencio são só pra me provar Há uma nova chance pra nós dois Em cada vez que eu não consigo te encarar E se eu te abraço eu não consigo mais soltar  Te olhava a dirigir Você sorria e pegava minha mão Só pra ter certeza que eu estava ali  Hoje eu não tenho mais você E desligo o radio quando a musica me lembra O que eu quero esquecer Me ajude a esquecer  Quero ouvir que nada vai mudar Que esse meses frios e o silencio são só pra me provar Há uma nova chance pra nós dois Em cada vez que não consigo te encarar E se eu te abraço eu não consigo mais soltar  E agora ouço a sua voz Me pedindo pra pensar em nós Mas eu nunca parei de pensar Somos dois corações assustados Um amor perfeito que deu errado Como eu faço pra consertar ?  Minhas lagrimas começam a cair Nós dois sabemos que eu tenho que sair daqui Mas paro pra te ouvir  E você diz que nada vai mudar Que o silencio é só pra me provar Há uma nova chance pra nós dois Em cada vez que não consigo te encarar E se eu te abraço eu não consigo  Quero ouvir que nada vai mudar Que esse meses frios e o silencio são só pra me provar Há uma nova chance pra nós dois Em cada vez que não consigo te encarar E se eu te abraço eu não consigo mais soltar,Manu Gavassi
Segredo (Feat. Chay Suede),/manu-gavassi/segredo-feat-chay-suede.html,Clichê Adolescente,"Seus olhos parecem perfeitos pros meus Sua boca parece que já percebeu Vem me conta um segredo Eu preciso escutar Seu sorriso me faz esquecer onde estou Se acordo sozinha já não sei quem sou Vem me abraça um segundo, e prometa ficar  Você virou o meu mundo, de ponta cabeça Vou dizer antes que eu esqueça Você foi o melhor que me aconteceu E agora nada é igual Nada importa no mundo quando você me beija Essa é minha única certeza Quando tudo em volta parece mudar, Pra mim devemos ficar pra sempre assim  Seus olhos me prendem e só você sabe Sua boca desmonta todo esse disfarce Você é o segredo. Que eu quero gritar  Você vira o meu mundo, de ponta cabeça Vou dizer antes que eu esqueça Você foi o melhor que me aconteceu E agora nada é igual Nada importa no mundo quando você me beija Essa é minha única certeza Quando tudo em volta parece mudar, Pra mim devemos ficar  Você vira o meu mundo, de ponta cabeça Vou dizer antes que eu esqueça Você foi o melhor que me aconteceu E agora nada é igual E nada importa no mundo quando você me beija Essa é minha única certeza Quando tudo em volta parece mudar, Pra mim devemos ficar pra sempre assim Pra sempre assim  Quando tudo em volta parece mudar, Pra mim devemos ficar pra sempre assim",Manu Gavassi
Seu Show,/manu-gavassi/seu-show.html,Regravação de Cine,"Vem, meu bem, que é pra eu poder te mostrar Me expressei mal, deixe-me consertar Quanto te vi o club inteiro balançou  Sua cara não nega Não quero ser só mais um pra você Teu olhar te entrega Não faço parte do seu show, assim eu sou  Sempre quis mergulhar num lance assim Vi nos meus sonhos como um filme Sonhar nunca é demais Baby, vem, deixa eu te roubar pra mim Só não demora, afinal nunca foi tão fácil assim  Down, down, down Baby, go down, down, down (down) (3x)  Dessa vez você não me engana Eu já sei de você e sua fama, tchau  Tudo bem,acho que falei de màs Sei que fez tudo isso e muito màs Mais você não imagina quem eu sou  Sua cara não nega Não quero ser só mais um pra você Teu olhar te entrega Não faço parte do seu show, assim eu sou  Sempre quis mergulhar num lance assim Vi nos meus sonhos como um filme Sonhar nunca é demais Baby, vem, deixa eu te roubar pra mim Só não demora, afinal nunca foi tão fácil assim  Down, down, down Baby, go down, down, down (down) (3x)  Dessa vez você não me engana Eu já sei de você e sua fama, tchau  Baby girl, I never felt so fine And you know you are the only one Baby girl, you are the only one (yeah, yeah)",Manu Gavassi
"Sim, É Sobre Você",/manu-gavassi/sim-e-sobre-voce.html,CUTE BUT PSYCHO EP,"Eu não se enlouqueci ou se foi você Vou fingir que eu esqueci pra eu não te responder Ouvi dizer que o nosso fim ficou mal resolvido pra você Logo pra mim que resolvi pra sobreviver  Mas o seu pensamento continua me atraindo pra você E o meu pensamento continua te atraindo sem querer Até quando? (até quando?) Até quando? até quando?  Agora eu sei, enlouqueci junto com você Fingindo amizade só pra não esquecer E seu amor te espera calma em você Não para de me observar sem saber porquê  É quando o seu pensamento continua me atraindo pra você (continua, continua me atraindo pra você) E o meu pensamento continua me traindo sem querer Até quando? Até quando? até quando?  Talvez o universo queira nos falar Um pedaço de você não possa me largar E nós dois somos estranhos e é estranho pensar Estranho lembrar seu nome sem me culpar Talvez seu pensamento venha pra curar A desculpa que você nunca soube me dar Mas desculpa não preciso mas nem tenho mais dor Você foi meu mais difícil exemplo de amor Talvez seja melhor que a gente nunca mais se viu Sua pele na minha pele, era certo, era arrepio A vontade não passava mesmo quando acabou Nunca foi por isso que a gente terminou E é por isso que eu me lembro  Até quando? (até quando?) Até quando? até quando? Até quando?",Manu Gavassi
Sonhei Com Uma Música Hoje,/manu-gavassi/sonhei-com-uma-musica-hoje.html,,"Eu gosto de você Muito sim Dormindo do meu lado, ou Dormindo sem mim Eu gosto de você Muito  Eu gosto de você e esse verso é seu Me olhando com essa cara De quem já entendeu Eu gosto de você Muito  Então não desiste de mim To louco pra falar que meu gostar já é amor  Enfim  Não desiste de nós To longe, mas to perto Se você quiser Se você quiser  Promete que fica Mesmo quando não for fácil ficar? E eu prometo que fico E falo que eu tenho tanto medo de falar Que eu gosto de você Muito Eu gosto de você Muito Eu gosto de você Tanto que eu amo você",Manu Gavassi
